id,submission_time,view_number,vote_number,title,message,image
0,1582247813,0,9,Co to jest?,Co to jest?,
1,1582281098,15,9,Ile lat ma moja mama?,Nie wiem gdzie to sprawdzić!,images/image1.png
5,1582237965,0,0,What will happen with messages after del of this??,I just wonder if it works...,
8,1582668749,0,5,How do i know when i should stop coding?,"Sometimes it is very hard to recognize, when you should turn off computer for your own sake.
what are the symptoms?
what should i do?
",
2,1582281003,0,16,How to make beautiful presentation,"I want to know, bastatrds!",
2,1582668775,0,0,Who am i,"Folks, help me. i don't know who i am.",
